{
  "id": "cus_verified",
  "specVersion": "0.2",
  "tenantId": "tenant_demo",
  "displayName": "Ada Lovelace",
  "email": "ada@example.com",
  "locale": "en-US",
  "region": "US",
  "identityVerification": {
    "status": "verified",
    "method": "document",
    "verifiedAt": "2026-01-01T00:00:00Z"
  },
  "tags": ["vip"],
  "createdAt": "2026-01-01T00:00:00Z",
  "updatedAt": "2026-01-10T00:00:00Z"
}
